{
  "$schema": "https://json-schema.org/draft/2020-12/schema",
  "title": "Auditor seed.json (Interface 5, A to C)",
  "description": "Interface 5. Versions 1/2: synthetic USD financial sources and scoring-only answer key. All money is exact integer cents. Validate relations with validate.py.",
  "type": "object",
  "additionalProperties": false,
  "required": [
    "schemaVersion",
    "seed",
    "dataset",
    "entity",
    "currency",
    "company",
    "accounts",
    "openingBalances",
    "periods",
    "bankTransactions",
    "stripePayouts",
    "contracts",
    "policyClauses",
    "vendors",
    "breaks",
    "answerKey",
    "fxRates"
  ],
  "properties": {
    "schemaVersion": {
      "enum": [
        "1.0.0",
        "2.0.0"
      ]
    },
    "seed": {
      "type": "integer"
    },
    "dataset": {
      "enum": [
        "generated",
        "sample"
      ]
    },
    "entity": {
      "$ref": "#/$defs/id",
      "description": "Shared entity ID: eo-festival-nyc for this demo."
    },
    "currency": {
      "$ref": "#/$defs/currency"
    },
    "company": {
      "type": "object",
      "additionalProperties": false,
      "required": [
        "name",
        "synthetic",
        "eventStartDate",
        "eventEndDate",
        "paidAttendance"
      ],
      "properties": {
        "name": {
          "$ref": "#/$defs/text"
        },
        "synthetic": {
          "const": true
        },
        "eventStartDate": {
          "$ref": "#/$defs/date"
        },
        "eventEndDate": {
          "$ref": "#/$defs/date"
        },
        "paidAttendance": {
          "type": "integer",
          "minimum": 0
        }
      }
    },
    "accounts": {
      "type": "array",
      "items": {
        "$ref": "#/$defs/account"
      },
      "minItems": 1
    },
    "openingBalances": {
      "type": "array",
      "items": {
        "$ref": "#/$defs/openingBalance"
      },
      "minItems": 2
    },
    "periods": {
      "type": "array",
      "items": {
        "$ref": "#/$defs/period"
      },
      "minItems": 1
    },
    "bankTransactions": {
      "type": "array",
      "items": {
        "$ref": "#/$defs/bankTransaction"
      }
    },
    "stripePayouts": {
      "type": "array",
      "items": {
        "$ref": "#/$defs/stripePayout"
      }
    },
    "contracts": {
      "type": "array",
      "items": {
        "$ref": "#/$defs/contract"
      }
    },
    "policyClauses": {
      "type": "array",
      "items": {
        "$ref": "#/$defs/policyClause"
      }
    },
    "vendors": {
      "type": "array",
      "items": {
        "$ref": "#/$defs/vendor"
      }
    },
    "breaks": {
      "type": "array",
      "items": {
        "$ref": "#/$defs/break"
      },
      "description": "Scoring annotations for six families; recurring and cross-period cases have distinct IDs. Never supply planted flags or answerKey to the agent."
    },
    "answerKey": {
      "type": "array",
      "items": {
        "$ref": "#/$defs/answer"
      },
      "description": "Scoring-only corrective entries, separate from imported books. Never index into retrieval or expose to an agent."
    },
    "fxRates": {
      "type": "array",
      "maxItems": 0,
      "description": "Reserved for the second-entity stretch. Must be empty for this USD-only Phase 1 contract."
    },
    "ledgerEntries": {
      "type": "array",
      "items": {
        "$ref": "#/$defs/ledgerEntry"
      }
    },
    "sourceDocuments": {
      "type": "array",
      "items": {
        "$ref": "#/$defs/sourceDocument"
      }
    }
  },
  "$defs": {
    "id": {
      "type": "string",
      "minLength": 1,
      "pattern": "^[A-Za-z0-9][A-Za-z0-9._-]*$"
    },
    "text": {
      "type": "string",
      "minLength": 1
    },
    "date": {
      "type": "string",
      "format": "date",
      "pattern": "^2026-[0-9]{2}-[0-9]{2}$"
    },
    "currency": {
      "const": "USD"
    },
    "accountCode": {
      "type": "string",
      "pattern": "^[0-9]{4}$"
    },
    "cents": {
      "type": "integer",
      "minimum": 0,
      "maximum": 9007199254740991
    },
    "periodId": {
      "type": "string",
      "pattern": "^2026-(07|08|09)$"
    },
    "account": {
      "type": "object",
      "additionalProperties": false,
      "required": [
        "id",
        "entity",
        "code",
        "name",
        "type",
        "normalBalance",
        "currency"
      ],
      "properties": {
        "id": {
          "$ref": "#/$defs/id"
        },
        "entity": {
          "$ref": "#/$defs/id"
        },
        "code": {
          "$ref": "#/$defs/accountCode"
        },
        "name": {
          "$ref": "#/$defs/text"
        },
        "type": {
          "enum": [
            "asset",
            "liability",
            "equity",
            "revenue",
            "expense"
          ]
        },
        "normalBalance": {
          "enum": [
            "debit",
            "credit"
          ]
        },
        "currency": {
          "$ref": "#/$defs/currency"
        }
      }
    },
    "journalLine": {
      "type": "object",
      "additionalProperties": false,
      "required": [
        "accountCode",
        "debit",
        "credit"
      ],
      "properties": {
        "accountCode": {
          "$ref": "#/$defs/accountCode"
        },
        "debit": {
          "$ref": "#/$defs/cents"
        },
        "credit": {
          "$ref": "#/$defs/cents"
        }
      },
      "oneOf": [
        {
          "properties": {
            "debit": {
              "minimum": 1
            },
            "credit": {
              "const": 0
            }
          }
        },
        {
          "properties": {
            "debit": {
              "const": 0
            },
            "credit": {
              "minimum": 1
            }
          }
        }
      ]
    },
    "openingBalance": {
      "type": "object",
      "additionalProperties": false,
      "required": [
        "id",
        "entity",
        "date",
        "accountCode",
        "debit",
        "credit"
      ],
      "properties": {
        "id": {
          "$ref": "#/$defs/id"
        },
        "entity": {
          "$ref": "#/$defs/id"
        },
        "date": {
          "$ref": "#/$defs/date"
        },
        "accountCode": {
          "$ref": "#/$defs/accountCode"
        },
        "debit": {
          "$ref": "#/$defs/cents"
        },
        "credit": {
          "$ref": "#/$defs/cents"
        }
      },
      "oneOf": [
        {
          "properties": {
            "debit": {
              "minimum": 1
            },
            "credit": {
              "const": 0
            }
          }
        },
        {
          "properties": {
            "debit": {
              "const": 0
            },
            "credit": {
              "minimum": 1
            }
          }
        }
      ]
    },
    "period": {
      "type": "object",
      "additionalProperties": false,
      "required": [
        "id",
        "entity",
        "startDate",
        "endDate",
        "status"
      ],
      "properties": {
        "id": {
          "$ref": "#/$defs/periodId"
        },
        "entity": {
          "$ref": "#/$defs/id"
        },
        "startDate": {
          "$ref": "#/$defs/date"
        },
        "endDate": {
          "$ref": "#/$defs/date"
        },
        "status": {
          "enum": [
            "open",
            "closing",
            "closed"
          ]
        }
      }
    },
    "bankTransaction": {
      "type": "object",
      "additionalProperties": false,
      "required": [
        "id",
        "entity",
        "period",
        "date",
        "amount",
        "currency",
        "counterparty",
        "description",
        "reference",
        "vendorId",
        "stripePayoutId",
        "status"
      ],
      "properties": {
        "id": {
          "$ref": "#/$defs/id"
        },
        "entity": {
          "$ref": "#/$defs/id"
        },
        "period": {
          "$ref": "#/$defs/periodId"
        },
        "date": {
          "$ref": "#/$defs/date"
        },
        "amount": {
          "type": "integer",
          "not": {
            "const": 0
          },
          "minimum": -9007199254740991,
          "maximum": 9007199254740991
        },
        "currency": {
          "$ref": "#/$defs/currency"
        },
        "counterparty": {
          "$ref": "#/$defs/text"
        },
        "description": {
          "$ref": "#/$defs/text"
        },
        "reference": {
          "$ref": "#/$defs/text"
        },
        "vendorId": {
          "anyOf": [
            {
              "$ref": "#/$defs/id"
            },
            {
              "type": "null"
            }
          ]
        },
        "stripePayoutId": {
          "anyOf": [
            {
              "$ref": "#/$defs/id"
            },
            {
              "type": "null"
            }
          ]
        },
        "status": {
          "enum": [
            "unmatched",
            "matched"
          ]
        }
      }
    },
    "stripePayout": {
      "type": "object",
      "additionalProperties": false,
      "required": [
        "id",
        "entity",
        "period",
        "arrivalDate",
        "currency",
        "gross",
        "fee",
        "net",
        "chargeCount",
        "bankTransactionId"
      ],
      "properties": {
        "id": {
          "$ref": "#/$defs/id"
        },
        "entity": {
          "$ref": "#/$defs/id"
        },
        "period": {
          "$ref": "#/$defs/periodId"
        },
        "arrivalDate": {
          "$ref": "#/$defs/date"
        },
        "currency": {
          "$ref": "#/$defs/currency"
        },
        "gross": {
          "type": "integer",
          "minimum": 1,
          "maximum": 9007199254740991
        },
        "fee": {
          "$ref": "#/$defs/cents"
        },
        "net": {
          "type": "integer",
          "minimum": 1,
          "maximum": 9007199254740991
        },
        "chargeCount": {
          "type": "integer",
          "minimum": 1
        },
        "bankTransactionId": {
          "$ref": "#/$defs/id"
        }
      },
      "description": "Normalized weekly report, not a raw Stripe API object. Gross less fee equals net, a positive bank receipt. Bank amount equals net."
    },
    "contractClause": {
      "type": "object",
      "additionalProperties": false,
      "required": [
        "id",
        "number",
        "text",
        "effectiveDate"
      ],
      "properties": {
        "id": {
          "$ref": "#/$defs/id"
        },
        "number": {
          "$ref": "#/$defs/text"
        },
        "text": {
          "$ref": "#/$defs/text"
        },
        "effectiveDate": {
          "$ref": "#/$defs/date"
        }
      }
    },
    "contract": {
      "type": "object",
      "additionalProperties": false,
      "required": [
        "id",
        "entity",
        "vendorId",
        "title",
        "signedDate",
        "startDate",
        "endDate",
        "currency",
        "clauses"
      ],
      "properties": {
        "id": {
          "$ref": "#/$defs/id"
        },
        "entity": {
          "$ref": "#/$defs/id"
        },
        "vendorId": {
          "$ref": "#/$defs/id"
        },
        "title": {
          "$ref": "#/$defs/text"
        },
        "signedDate": {
          "$ref": "#/$defs/date"
        },
        "startDate": {
          "$ref": "#/$defs/date"
        },
        "endDate": {
          "$ref": "#/$defs/date"
        },
        "currency": {
          "$ref": "#/$defs/currency"
        },
        "clauses": {
          "type": "array",
          "items": {
            "$ref": "#/$defs/contractClause"
          },
          "minItems": 1
        }
      }
    },
    "policyClause": {
      "type": "object",
      "additionalProperties": false,
      "required": [
        "id",
        "entity",
        "policyPackId",
        "number",
        "text",
        "effectiveDate"
      ],
      "properties": {
        "id": {
          "$ref": "#/$defs/id"
        },
        "entity": {
          "$ref": "#/$defs/id"
        },
        "policyPackId": {
          "$ref": "#/$defs/id"
        },
        "number": {
          "$ref": "#/$defs/text"
        },
        "text": {
          "$ref": "#/$defs/text"
        },
        "effectiveDate": {
          "$ref": "#/$defs/date"
        }
      }
    },
    "vendor": {
      "type": "object",
      "additionalProperties": false,
      "required": [
        "id",
        "entity",
        "name",
        "category",
        "bankAccountLast4",
        "crsTestIdentity"
      ],
      "properties": {
        "id": {
          "$ref": "#/$defs/id"
        },
        "entity": {
          "$ref": "#/$defs/id"
        },
        "name": {
          "$ref": "#/$defs/text"
        },
        "category": {
          "$ref": "#/$defs/text"
        },
        "bankAccountLast4": {
          "type": "string",
          "pattern": "^[0-9]{4}$"
        },
        "crsTestIdentity": {
          "anyOf": [
            {
              "$ref": "#/$defs/id"
            },
            {
              "type": "null"
            }
          ],
          "description": "Sponsor-issued sandbox test identity ID only. Null means not configured; verification must fail closed. Never real PII or an invented ID."
        }
      }
    },
    "break": {
      "type": "object",
      "additionalProperties": false,
      "required": [
        "id",
        "entity",
        "period",
        "kind",
        "description",
        "bankTransactionIds",
        "contractIds",
        "status"
      ],
      "properties": {
        "id": {
          "$ref": "#/$defs/id"
        },
        "entity": {
          "$ref": "#/$defs/id"
        },
        "period": {
          "$ref": "#/$defs/periodId"
        },
        "kind": {
          "enum": [
            "stripe_fee_netting",
            "duplicate_payable",
            "deposit_shortfall",
            "contract_amendment",
            "bank_detail_change",
            "missing_accrual",
            "other"
          ]
        },
        "description": {
          "$ref": "#/$defs/text"
        },
        "bankTransactionIds": {
          "type": "array",
          "items": {
            "$ref": "#/$defs/id"
          },
          "uniqueItems": true
        },
        "contractIds": {
          "type": "array",
          "items": {
            "$ref": "#/$defs/id"
          },
          "uniqueItems": true
        },
        "status": {
          "enum": [
            "open",
            "resolved",
            "escalated"
          ]
        },
        "breakNumber": {
          "type": "integer",
          "minimum": 1,
          "maximum": 6
        },
        "date": {
          "$ref": "#/$defs/date"
        },
        "sourceDocumentIds": {
          "type": "array",
          "uniqueItems": true,
          "items": {
            "$ref": "#/$defs/id"
          }
        },
        "ledgerEntryIds": {
          "type": "array",
          "uniqueItems": true,
          "items": {
            "$ref": "#/$defs/id"
          }
        }
      }
    },
    "answer": {
      "type": "object",
      "additionalProperties": false,
      "required": [
        "id",
        "entity",
        "breakId",
        "period",
        "expectedAction",
        "expectedLines",
        "citationIds",
        "expectedEscalation",
        "pnlImpact",
        "explanation"
      ],
      "properties": {
        "id": {
          "$ref": "#/$defs/id"
        },
        "entity": {
          "$ref": "#/$defs/id"
        },
        "breakId": {
          "$ref": "#/$defs/id"
        },
        "period": {
          "$ref": "#/$defs/periodId"
        },
        "expectedAction": {
          "$ref": "#/$defs/text"
        },
        "expectedLines": {
          "type": "array",
          "items": {
            "$ref": "#/$defs/journalLine"
          }
        },
        "citationIds": {
          "type": "array",
          "items": {
            "$ref": "#/$defs/id"
          },
          "uniqueItems": true
        },
        "expectedEscalation": {
          "type": "boolean"
        },
        "pnlImpact": {
          "$ref": "#/$defs/cents"
        },
        "explanation": {
          "$ref": "#/$defs/text"
        },
        "breakNumber": {
          "type": "integer",
          "minimum": 1,
          "maximum": 6
        },
        "dependsOn": {
          "type": "array",
          "uniqueItems": true,
          "items": {
            "$ref": "#/$defs/id"
          }
        }
      }
    },
    "ledgerEntry": {
      "type": "object",
      "additionalProperties": false,
      "required": [
        "id",
        "entity",
        "period",
        "date",
        "lines",
        "memo",
        "reference",
        "vendorId",
        "bankTransactionId"
      ],
      "properties": {
        "id": {
          "$ref": "#/$defs/id"
        },
        "entity": {
          "$ref": "#/$defs/id"
        },
        "period": {
          "$ref": "#/$defs/periodId"
        },
        "date": {
          "$ref": "#/$defs/date"
        },
        "lines": {
          "type": "array",
          "minItems": 2,
          "items": {
            "$ref": "#/$defs/journalLine"
          }
        },
        "memo": {
          "$ref": "#/$defs/text"
        },
        "reference": {
          "$ref": "#/$defs/text"
        },
        "vendorId": {
          "anyOf": [
            {
              "$ref": "#/$defs/id"
            },
            {
              "type": "null"
            }
          ]
        },
        "bankTransactionId": {
          "anyOf": [
            {
              "$ref": "#/$defs/id"
            },
            {
              "type": "null"
            }
          ]
        }
      }
    },
    "sourceDocument": {
      "type": "object",
      "additionalProperties": false,
      "required": [
        "id",
        "entity",
        "period",
        "date",
        "kind",
        "vendorId",
        "contractId",
        "title",
        "text",
        "amount",
        "reference"
      ],
      "properties": {
        "id": {
          "$ref": "#/$defs/id"
        },
        "entity": {
          "$ref": "#/$defs/id"
        },
        "period": {
          "$ref": "#/$defs/periodId"
        },
        "date": {
          "$ref": "#/$defs/date"
        },
        "kind": {
          "enum": [
            "invoice",
            "cancellation",
            "amendment",
            "attendance",
            "bank_change",
            "payment_request",
            "service_schedule"
          ]
        },
        "vendorId": {
          "$ref": "#/$defs/id"
        },
        "contractId": {
          "$ref": "#/$defs/id"
        },
        "title": {
          "$ref": "#/$defs/text"
        },
        "text": {
          "$ref": "#/$defs/text"
        },
        "amount": {
          "anyOf": [
            {
              "$ref": "#/$defs/cents"
            },
            {
              "type": "null"
            }
          ]
        },
        "reference": {
          "anyOf": [
            {
              "$ref": "#/$defs/text"
            },
            {
              "type": "null"
            }
          ]
        }
      }
    }
  },
  "allOf": [
    {
      "if": {
        "properties": {
          "schemaVersion": {
            "const": "2.0.0"
          }
        }
      },
      "then": {
        "required": [
          "ledgerEntries",
          "sourceDocuments"
        ]
      }
    }
  ]
}
