{
  "schemaVersion": "1.0.0",
  "seed": 1328,
  "dataset": "sample",
  "entity": "eo-festival-nyc",
  "currency": "USD",
  "company": {
    "name": "Experts Only Festival NYC",
    "synthetic": true,
    "eventStartDate": "2026-09-19",
    "eventEndDate": "2026-09-20",
    "paidAttendance": 50000
  },
  "accounts": [
    {
      "id": "acct-1000",
      "entity": "eo-festival-nyc",
      "code": "1000",
      "name": "Cash",
      "type": "asset",
      "normalBalance": "debit",
      "currency": "USD"
    },
    {
      "id": "acct-1010",
      "entity": "eo-festival-nyc",
      "code": "1010",
      "name": "Stripe clearing",
      "type": "asset",
      "normalBalance": "debit",
      "currency": "USD"
    },
    {
      "id": "acct-1100",
      "entity": "eo-festival-nyc",
      "code": "1100",
      "name": "Accounts receivable",
      "type": "asset",
      "normalBalance": "debit",
      "currency": "USD"
    },
    {
      "id": "acct-1150",
      "entity": "eo-festival-nyc",
      "code": "1150",
      "name": "Sponsorship receivable",
      "type": "asset",
      "normalBalance": "debit",
      "currency": "USD"
    },
    {
      "id": "acct-1200",
      "entity": "eo-festival-nyc",
      "code": "1200",
      "name": "Vendor deposits",
      "type": "asset",
      "normalBalance": "debit",
      "currency": "USD"
    },
    {
      "id": "acct-1250",
      "entity": "eo-festival-nyc",
      "code": "1250",
      "name": "Artist deposits",
      "type": "asset",
      "normalBalance": "debit",
      "currency": "USD"
    },
    {
      "id": "acct-1300",
      "entity": "eo-festival-nyc",
      "code": "1300",
      "name": "Prepaid expenses",
      "type": "asset",
      "normalBalance": "debit",
      "currency": "USD"
    },
    {
      "id": "acct-1400",
      "entity": "eo-festival-nyc",
      "code": "1400",
      "name": "Payments under review",
      "type": "asset",
      "normalBalance": "debit",
      "currency": "USD"
    },
    {
      "id": "acct-2000",
      "entity": "eo-festival-nyc",
      "code": "2000",
      "name": "Accounts payable",
      "type": "liability",
      "normalBalance": "credit",
      "currency": "USD"
    },
    {
      "id": "acct-2100",
      "entity": "eo-festival-nyc",
      "code": "2100",
      "name": "Accrued liabilities",
      "type": "liability",
      "normalBalance": "credit",
      "currency": "USD"
    },
    {
      "id": "acct-2200",
      "entity": "eo-festival-nyc",
      "code": "2200",
      "name": "Deferred ticket revenue",
      "type": "liability",
      "normalBalance": "credit",
      "currency": "USD"
    },
    {
      "id": "acct-2250",
      "entity": "eo-festival-nyc",
      "code": "2250",
      "name": "Deferred sponsorship revenue",
      "type": "liability",
      "normalBalance": "credit",
      "currency": "USD"
    },
    {
      "id": "acct-3000",
      "entity": "eo-festival-nyc",
      "code": "3000",
      "name": "Common stock",
      "type": "equity",
      "normalBalance": "credit",
      "currency": "USD"
    },
    {
      "id": "acct-3100",
      "entity": "eo-festival-nyc",
      "code": "3100",
      "name": "Retained earnings",
      "type": "equity",
      "normalBalance": "credit",
      "currency": "USD"
    },
    {
      "id": "acct-4000",
      "entity": "eo-festival-nyc",
      "code": "4000",
      "name": "Ticket revenue",
      "type": "revenue",
      "normalBalance": "credit",
      "currency": "USD"
    },
    {
      "id": "acct-4100",
      "entity": "eo-festival-nyc",
      "code": "4100",
      "name": "Sponsorship revenue",
      "type": "revenue",
      "normalBalance": "credit",
      "currency": "USD"
    },
    {
      "id": "acct-5000",
      "entity": "eo-festival-nyc",
      "code": "5000",
      "name": "Artist fees",
      "type": "expense",
      "normalBalance": "debit",
      "currency": "USD"
    },
    {
      "id": "acct-5050",
      "entity": "eo-festival-nyc",
      "code": "5050",
      "name": "Artist cancellation fees",
      "type": "expense",
      "normalBalance": "debit",
      "currency": "USD"
    },
    {
      "id": "acct-5100",
      "entity": "eo-festival-nyc",
      "code": "5100",
      "name": "Production",
      "type": "expense",
      "normalBalance": "debit",
      "currency": "USD"
    },
    {
      "id": "acct-5150",
      "entity": "eo-festival-nyc",
      "code": "5150",
      "name": "Staging and equipment",
      "type": "expense",
      "normalBalance": "debit",
      "currency": "USD"
    },
    {
      "id": "acct-5160",
      "entity": "eo-festival-nyc",
      "code": "5160",
      "name": "Equipment inspection and damage fees",
      "type": "expense",
      "normalBalance": "debit",
      "currency": "USD"
    },
    {
      "id": "acct-5200",
      "entity": "eo-festival-nyc",
      "code": "5200",
      "name": "Security",
      "type": "expense",
      "normalBalance": "debit",
      "currency": "USD"
    },
    {
      "id": "acct-5300",
      "entity": "eo-festival-nyc",
      "code": "5300",
      "name": "Catering",
      "type": "expense",
      "normalBalance": "debit",
      "currency": "USD"
    },
    {
      "id": "acct-5400",
      "entity": "eo-festival-nyc",
      "code": "5400",
      "name": "Payment processing fees",
      "type": "expense",
      "normalBalance": "debit",
      "currency": "USD"
    },
    {
      "id": "acct-5500",
      "entity": "eo-festival-nyc",
      "code": "5500",
      "name": "Venue and permits",
      "type": "expense",
      "normalBalance": "debit",
      "currency": "USD"
    },
    {
      "id": "acct-5600",
      "entity": "eo-festival-nyc",
      "code": "5600",
      "name": "Marketing",
      "type": "expense",
      "normalBalance": "debit",
      "currency": "USD"
    },
    {
      "id": "acct-5900",
      "entity": "eo-festival-nyc",
      "code": "5900",
      "name": "G&A",
      "type": "expense",
      "normalBalance": "debit",
      "currency": "USD"
    }
  ],
  "openingBalances": [
    {
      "id": "opening-1000",
      "entity": "eo-festival-nyc",
      "date": "2026-07-01",
      "accountCode": "1000",
      "debit": 38000000,
      "credit": 0
    },
    {
      "id": "opening-1300",
      "entity": "eo-festival-nyc",
      "date": "2026-07-01",
      "accountCode": "1300",
      "debit": 6000000,
      "credit": 0
    },
    {
      "id": "opening-3000",
      "entity": "eo-festival-nyc",
      "date": "2026-07-01",
      "accountCode": "3000",
      "debit": 0,
      "credit": 50000000
    },
    {
      "id": "opening-3100",
      "entity": "eo-festival-nyc",
      "date": "2026-07-01",
      "accountCode": "3100",
      "debit": 6000000,
      "credit": 0
    }
  ],
  "periods": [
    {
      "id": "2026-07",
      "entity": "eo-festival-nyc",
      "startDate": "2026-07-01",
      "endDate": "2026-07-31",
      "status": "open"
    },
    {
      "id": "2026-08",
      "entity": "eo-festival-nyc",
      "startDate": "2026-08-01",
      "endDate": "2026-08-31",
      "status": "open"
    },
    {
      "id": "2026-09",
      "entity": "eo-festival-nyc",
      "startDate": "2026-09-01",
      "endDate": "2026-09-30",
      "status": "open"
    }
  ],
  "bankTransactions": [
    {
      "id": "sample-bank-01",
      "entity": "eo-festival-nyc",
      "period": "2026-07",
      "date": "2026-07-02",
      "amount": -6000000,
      "currency": "USD",
      "counterparty": "The Northern Lines",
      "description": "Artist deposit, 50% on signing",
      "reference": "NL-DEPOSIT",
      "vendorId": "northern-lines",
      "stripePayoutId": null,
      "status": "unmatched"
    },
    {
      "id": "sample-bank-02",
      "entity": "eo-festival-nyc",
      "period": "2026-07",
      "date": "2026-07-10",
      "amount": 4718000,
      "currency": "USD",
      "counterparty": "Stripe",
      "description": "Weekly ticket payout, net of fees",
      "reference": "po_sample_jul",
      "vendorId": null,
      "stripePayoutId": "po_sample_jul",
      "status": "unmatched"
    },
    {
      "id": "sample-bank-03",
      "entity": "eo-festival-nyc",
      "period": "2026-07",
      "date": "2026-07-15",
      "amount": -125000,
      "currency": "USD",
      "counterparty": "Beacon Creative",
      "description": "Campaign creative",
      "reference": "BC-0715",
      "vendorId": "beacon",
      "stripePayoutId": null,
      "status": "unmatched"
    },
    {
      "id": "sample-bank-04",
      "entity": "eo-festival-nyc",
      "period": "2026-07",
      "date": "2026-07-23",
      "amount": -1850000,
      "currency": "USD",
      "counterparty": "SoundWave Production",
      "description": "Production services",
      "reference": "SW-1041",
      "vendorId": "soundwave",
      "stripePayoutId": null,
      "status": "unmatched"
    },
    {
      "id": "sample-bank-05",
      "entity": "eo-festival-nyc",
      "period": "2026-08",
      "date": "2026-08-07",
      "amount": 9710000,
      "currency": "USD",
      "counterparty": "Stripe",
      "description": "Weekly ticket payout, net of fees",
      "reference": "po_sample_aug",
      "vendorId": null,
      "stripePayoutId": "po_sample_aug",
      "status": "unmatched"
    },
    {
      "id": "sample-bank-06",
      "entity": "eo-festival-nyc",
      "period": "2026-08",
      "date": "2026-08-20",
      "amount": -1600000,
      "currency": "USD",
      "counterparty": "Apex Staging",
      "description": "Refundable equipment damage deposit",
      "reference": "APEX-DEPOSIT",
      "vendorId": "apex",
      "stripePayoutId": null,
      "status": "unmatched"
    },
    {
      "id": "sample-bank-07",
      "entity": "eo-festival-nyc",
      "period": "2026-08",
      "date": "2026-08-28",
      "amount": -240000,
      "currency": "USD",
      "counterparty": "Island Event Permits",
      "description": "Permit administration",
      "reference": "IEP-0828",
      "vendorId": "city-permits",